"Authors","Author full names","Author(s) ID","Title","Year","Link"
"Villarreal E.R.L.; Salazar A.O.; Da Silva W.L.A.; Pereira V.M.D.S.","Villarreal, Elmer R. L. (55361069800); Salazar, Andres O. (7102422753); Da Silva, Werbert L. A. (57194058482); Pereira, Vitor M. D. S. (57245375700)","55361069800; 7102422753; 57194058482; 57245375700","Impulse elimination for singular second-order system: Approach","2021","https://www.scopus.com/inward/record.uri?eid=2-s2.0-85114197133&doi=10.1109%2fICAACCA51523.2021.9465327&partnerID=40&md5=9f6a490d6434000a16c28d1db30b1199"
"Machado M.O.; Goldbarg E.F.G.; Goldbarg M.C.; Sabry G.D.A.; Fernandes I.F.C.; Marques T.S.","Machado, Murilo Oliveira (57197830032); Goldbarg, Elizabeth F. Gouvea (14033766000); Goldbarg, Marco Cesar (8873773400); Sabry, Gustavo De Araujo (57217007347); Fernandes, Islame F. Costa (57212227502); Marques, Thiago Soares (58026487800)","57197830032; 14033766000; 8873773400; 57217007347; 57212227502; 58026487800","Heuristic Hybridization for CaRSP, a multilevel decision problem","2021","https://www.scopus.com/inward/record.uri?eid=2-s2.0-85125772805&doi=10.1109%2fSSCI50451.2021.9660015&partnerID=40&md5=2f4bb61b6f3061b4b6d98b3b1e9f5d4a"
"Da Silva W.L.A.; Salazar A.O.; Vieira P.V.F.; Jacome M.C.; Villarreal E.R.L.","Da Silva, Werbet L. A. (57194058482); Salazar, Andres O. (7102422753); Vieira, Paulo V. F. (57244861900); Jacome, Maxwell C. (57245200700); Villarreal, Elmer R. L. (55361069800)","57194058482; 7102422753; 57244861900; 57245200700; 55361069800","Radial position control of a bearingless machine with active disturbance rejection control fuzzy an approach","2021","https://www.scopus.com/inward/record.uri?eid=2-s2.0-85114202854&doi=10.1109%2fICAACCA51523.2021.9465177&partnerID=40&md5=654bc4b5efd465344b80a3922f793a62"
"Siljak H.; Nardelli P.H.J.; Moioli R.C.","Siljak, Harun (37097991800); Nardelli, Pedro H. J. (24781106100); Moioli, Renan Cipriano (13006817400)","37097991800; 24781106100; 13006817400","Cyborg Insects: Bug or a Feature?","2022","https://www.scopus.com/inward/record.uri?eid=2-s2.0-85130073636&doi=10.1109%2fACCESS.2022.3172980&partnerID=40&md5=4088a162a94c9740deb371778df332f9"
"Moreira de Lima J.M.; Ugulino de Araújo F.M.","Moreira de Lima, Jean Mário (57223363552); Ugulino de Araújo, Fábio Meneghetti (35316777100)","57223363552; 35316777100","Industrial semi-supervised dynamic soft-sensor modeling approach based on deep relevant representation learning","2021","https://www.scopus.com/inward/record.uri?eid=2-s2.0-85105740934&doi=10.3390%2fs21103430&partnerID=40&md5=254b27b3fec7c7c0cc1ecdca660d44c5"
"Silva A.; Aloise D.; Coelho L.C.; Rocha C.","Silva, Allyson (57211991683); Aloise, Daniel (12759644500); Coelho, Leandro C. (54890623600); Rocha, Caroline (25927437400)","57211991683; 12759644500; 54890623600; 25927437400","Heuristics for the dynamic facility location problem with modular capacities","2021","https://www.scopus.com/inward/record.uri?eid=2-s2.0-85090312048&doi=10.1016%2fj.ejor.2020.08.018&partnerID=40&md5=679c226ca2031a2bdbd3cbad969aa086"
"Almeida T.A.; Dórea C.E.T.","Almeida, Tiago A. (57204728032); Dórea, Carlos E. T. (7004096252)","57204728032; 7004096252","Output Feedback Constrained Regulation of Linear Systems via Controlled-Invariant Sets","2021","https://www.scopus.com/inward/record.uri?eid=2-s2.0-85112561349&doi=10.1109%2fTAC.2020.3020100&partnerID=40&md5=67bebf6c4290b197fe06fd3d45c6ecc0"
"Silva M.; Signoretti G.; Andrade P.; Silva I.; Ferrari P.","Silva, Marianne (57207807053); Signoretti, Gabriel (57192920994); Andrade, Pedro (57225443488); Silva, Ivanovitch (36537969500); Ferrari, Paolo (57195277194)","57207807053; 57192920994; 57225443488; 36537969500; 57195277194","Towards a customized vehicular maintenance based on 2-layers data-stream application","2021","https://www.scopus.com/inward/record.uri?eid=2-s2.0-85114962520&doi=10.1109%2fMetroAutomotive50197.2021.9502892&partnerID=40&md5=98d4c9430106a9492668db1398faca33"
"Nascimento L.B.P.; Barrios-Aranibar D.; Santos V.G.; Pereira D.S.; Ribeiro W.C.; Alsina P.J.","Nascimento, Luís B. P. (57202607438); Barrios-Aranibar, Dennis (15844905100); Santos, Vitor G. (57214224477); Pereira, Diego S. (57202609106); Ribeiro, William C. (57224632924); Alsina, Pablo J. (6603627735)","57202607438; 15844905100; 57214224477; 57202609106; 57224632924; 6603627735","Safe path planning algorithms for mobile robots based on probabilistic foam","2021","https://www.scopus.com/inward/record.uri?eid=2-s2.0-85108064370&doi=10.3390%2fs21124156&partnerID=40&md5=967e1bfe92901a02f29926dbcb7b057b"
"Nascimento L.M.; Neri D.S.; Ferreira T.N.; Pereira F.A.; Albuquerque E.A.Y.; Gonçalves L.M.G.; Sá S.T.L.","Nascimento, Lucas Moura do (57216058051); Neri, Davi Souto (57215870557); Ferreira, Thiago do Nascimento (57215872286); Pereira, Francinaldo de Almeida (57206167536); Albuquerque, Erika Akemi Yanaguibashi (57205730944); Gonçalves, Luiz Marcos Garcia (58069927800); Sá, Sarah Thomaz de Lima (57193607830)","57216058051; 57215870557; 57215872286; 57206167536; 57205730944; 58069927800; 57193607830","sBotics - Gamified Framework for Educational Robotics","2021","https://www.scopus.com/inward/record.uri?eid=2-s2.0-85104660045&doi=10.1007%2fs10846-021-01364-8&partnerID=40&md5=734f94e0301a49595ce3b6c0d3461149"
"Araújo J.M.; Bettega J.; Dantas N.J.B.; Dórea C.E.T.; Richiedei D.; Tamellin I.","Araújo, José Mário (36808912600); Bettega, Jason (57218589262); Dantas, Nelson J. B. (57211270481); Dórea, Carlos E. T. (7004096252); Richiedei, Dario (24462353500); Tamellin, Iacopo (57203749099)","36808912600; 57218589262; 57211270481; 7004096252; 24462353500; 57203749099","Vibration control of a two-link flexible robot arm with time delay through the robust receptance method","2021","https://www.scopus.com/inward/record.uri?eid=2-s2.0-85117584408&doi=10.3390%2fapp11219907&partnerID=40&md5=b4a58cc1afb7abc913829c3abebe550a"
"Lima A.; Palmeira E.S.; Bedregal B.; Bustince H.","Lima, Annaxsuel (57211404216); Palmeira, Eduardo S. (37261839800); Bedregal, Benjamin (15520790700); Bustince, Humberto (55034746100)","57211404216; 37261839800; 15520790700; 55034746100","Multidimensional Fuzzy Sets","2021","https://www.scopus.com/inward/record.uri?eid=2-s2.0-85085771413&doi=10.1109%2fTFUZZ.2020.2994997&partnerID=40&md5=938700088a3d9e195e8e324460283fe5"
"Oliveira T.H.F.D.; Medeiros L.P.D.S.; Neto A.D.D.; Melo J.D.","Oliveira, Thiago Henrique Freire de (57191658407); Medeiros, Luiz Paulo de Souza (57220022529); Neto, Adrião Duarte Dória (7102618949); Melo, Jorge Dantas (55664205300)","57191658407; 57220022529; 7102618949; 55664205300","Q-Managed: A new algorithm for a multiobjective reinforcement learning","2021","https://www.scopus.com/inward/record.uri?eid=2-s2.0-85096606855&doi=10.1016%2fj.eswa.2020.114228&partnerID=40&md5=3a3a4c732a24f4a8504e1d4f1294ba15"
"Silva M.; Signoretti G.; Flores T.; Andrade P.; Silva J.; Silva I.; Sisinni E.; Ferrari P.","Silva, Marianne (57207807053); Signoretti, Gabriel (57192920994); Flores, Thommas (57211156889); Andrade, Pedro (57225443488); Silva, Jordao (55447877300); Silva, Ivanovitch (36537969500); Sisinni, Emiliano (24777116800); Ferrari, Paolo (57195277194)","57207807053; 57192920994; 57211156889; 57225443488; 55447877300; 36537969500; 24777116800; 57195277194","A data-stream TinyML compression algorithm for vehicular applications: a case study","2022","https://www.scopus.com/inward/record.uri?eid=2-s2.0-85136105811&doi=10.1109%2fMetroInd4.0IoT54413.2022.9831606&partnerID=40&md5=c5ce85e66872e648c6c842f405080008"
"Jardim S.; Dantas Silva F.S.; Neto A.; Bustos H.; Immich R.; Fontes R.","Jardim, Sandino (55693735600); Dantas Silva, Felipe S. (56393770300); Neto, Augusto (35105652600); Bustos, Harold (16021045500); Immich, Roger (23990618900); Fontes, Ramon (57188683331)","55693735600; 56393770300; 35105652600; 16021045500; 23990618900; 57188683331","Analysis of ML Algorithms to Support Elastic Service Chaining in eHealth Vertical Applications","2021","https://www.scopus.com/inward/record.uri?eid=2-s2.0-85125649579&doi=10.1109%2fIWCMC51323.2021.9498641&partnerID=40&md5=31402e9cbabb5f0ea26a7d0325e5e940"
"De Gois C.; Moreno G.; Nery R.; Brito S.; Chaves R.; Rabelo R.","De Gois, Carlos (57222114104); Moreno, George (57219781378); Nery, Ranieri (56755042900); Brito, Samuraí (57189867246); Chaves, Rafael (23977564500); Rabelo, Rafael (54919365800)","57222114104; 57219781378; 56755042900; 57189867246; 23977564500; 54919365800","General Method for Classicality Certification in the Prepare and Measure Scenario","2021","https://www.scopus.com/inward/record.uri?eid=2-s2.0-85126620640&doi=10.1103%2fPRXQuantum.2.030311&partnerID=40&md5=b51641ad91481098375e69ba77c24fd6"
"Signoretti G.; Silva M.; Andrade P.; Silva I.; Sisinni E.; Ferrari P.","Signoretti, Gabriel (57192920994); Silva, Marianne (57207807053); Andrade, Pedro (57225443488); Silva, Ivanovitch (36537969500); Sisinni, Emiliano (24777116800); Ferrari, Paolo (57195277194)","57192920994; 57207807053; 57225443488; 36537969500; 24777116800; 57195277194","An evolving tinyml compression algorithm for iot environments based on data eccentricity","2021","https://www.scopus.com/inward/record.uri?eid=2-s2.0-85107982881&doi=10.3390%2fs21124153&partnerID=40&md5=e5a531080c0a802966382b71021c8844"
"Ortiz-Fernandez L.E.; Cabrera-Avila E.V.; da Silva B.M.F.; Gonçalves L.M.G.","Ortiz-Fernandez, Luis E. (57221782148); Cabrera-Avila, Elizabeth V. (57221781672); da Silva, Bruno M. F. (57203157372); Gonçalves, Luiz M. G. (58069927800)","57221782148; 57221781672; 57203157372; 58069927800","Smart artificial markers for accurate visual mapping and localization","2021","https://www.scopus.com/inward/record.uri?eid=2-s2.0-85100192674&doi=10.3390%2fs21020625&partnerID=40&md5=fcda19329926cecf7f3965c88a4e9bda"
"Melo S.; Oliveira F.; Silva C.; Lopes P.; Aquino G.","Melo, Sávio (57207778575); Oliveira, Felipe (57541992900); Silva, Cícero (57169408600); Lopes, Paulo (57386072400); Aquino, Gibeon (35787927400)","57207778575; 57541992900; 57169408600; 57386072400; 35787927400","OffFog: An Approach to Support the Definition of Offloading Policies on Fog Computing","2022","https://www.scopus.com/inward/record.uri?eid=2-s2.0-85123204532&doi=10.1155%2f2022%2f5331712&partnerID=40&md5=0db6d21e8e42a4946ca9d77e2d7805f7"
"Bergamaschi F.B.; Santiago R.H.N.","Bergamaschi, Flaulles Boone (55904314100); Santiago, Regivan Hugo Nunes (7006674404)","55904314100; 7006674404","A Study on Constrained Interval Arithmetic","2022","https://www.scopus.com/inward/record.uri?eid=2-s2.0-85113392964&doi=10.1007%2f978-3-030-82099-2_3&partnerID=40&md5=38b657b6cb32a3a0731f20b23c771a2f"
"De Almeida R.R.; Do Nascimento Ribeiro R.; Treude C.; Kulesza U.","De Almeida, Rodrigo Reboucas (57219586098); Do Nascimento Ribeiro, Rafael (57223122629); Treude, Christoph (23135531900); Kulesza, Uira (12645089300)","57219586098; 57223122629; 23135531900; 12645089300","Business-Driven Technical Debt Prioritization: An Industrial Case Study","2021","https://www.scopus.com/inward/record.uri?eid=2-s2.0-85114801235&doi=10.1109%2fTechDebt52882.2021.00017&partnerID=40&md5=f03b0698949216788b667bb19ddafbe8"
"Pronin S.; Wellacott L.; Pimentel J.; Moioli R.C.; Vargas P.A.","Pronin, Savva (57193324463); Wellacott, Liam (57222660005); Pimentel, Jhielson (57209482289); Moioli, Renan C. (13006817400); Vargas, Patricia A. (55146997400)","57193324463; 57222660005; 57209482289; 13006817400; 55146997400","Neurorobotic Models of Neurological Disorders: A Mini Review","2021","https://www.scopus.com/inward/record.uri?eid=2-s2.0-85103613676&doi=10.3389%2ffnbot.2021.634045&partnerID=40&md5=fa7adbc4357cdeb226035214e40e7620"
"Lucena A.N.; Freire-Junior R.C.S.; Goncalves L.M.G.","Lucena, Alysson Nascimento (57221819696); Freire-Junior, Raimundo Carlos Silverio (36979704500); Goncalves, Luiz Marcos Garcia (58069927800)","57221819696; 36979704500; 58069927800","Unmanned Aerial Vehicle with Hybrid Lift and Propulsion","2021","https://www.scopus.com/inward/record.uri?eid=2-s2.0-85123469285&doi=10.1109%2fLARS%2fSBR%2fWRE54079.2021.9605409&partnerID=40&md5=7712031c66032f90b89752b66ede75a4"
"Paiva R.; Santiago R.; Bedregal B.; Palmeira E.","Paiva, Rui (57203242664); Santiago, Regivan (7006674404); Bedregal, Benjamín (15520790700); Palmeira, Eduardo (37261839800)","57203242664; 7006674404; 15520790700; 37261839800","Lattice-valued overlap and quasi-overlap functions","2021","https://www.scopus.com/inward/record.uri?eid=2-s2.0-85101867568&doi=10.1016%2fj.ins.2021.02.010&partnerID=40&md5=81a772f992f013771ce5e2aefda7d941"
"Novotny A.A.; Lopes C.G.; Santos R.B.","Novotny, A.A. (7006022758); Lopes, C.G. (56849932800); Santos, R.B. (56849964300)","7006022758; 56849932800; 56849964300","Topological derivative-based topology optimization of structures subject to self-weight loading","2021","https://www.scopus.com/inward/record.uri?eid=2-s2.0-85098726759&doi=10.1007%2fs00158-020-02780-4&partnerID=40&md5=fc39e09eff82755b934d6f62544edb37"
"Oliveira W.; Campos M.; Medeiros A.; Sousa V.","Oliveira, Wellerson (57226635570); Campos, Millena (57382309000); Medeiros, Alvaro (15924771000); Sousa, Vicente (6603844872)","57226635570; 57382309000; 15924771000; 6603844872","Statistical analysis of the influence of peoplemovement and antenna radiation pattern onsmall-scale fading","2021","https://www.scopus.com/inward/record.uri?eid=2-s2.0-85112215533&doi=10.1109%2fTLA.2021.9475623&partnerID=40&md5=49deda0b9b7db5bb36e0b8152dfefa9d"
"Lucena A.N.; Goncalves L.M.G.","Lucena, Alysson N. (57221819696); Goncalves, Luiz M. G. (58069927800)","57221819696; 58069927800","MicroBrosh UAV: A Basic Risk Operation Self Handled Platform","2021","https://www.scopus.com/inward/record.uri?eid=2-s2.0-85111443073&doi=10.1109%2fICUAS51884.2021.9476702&partnerID=40&md5=b30dfd9972aae2fb59ae8f11a06a6574"
"Vale K.M.O.; Gorgonio A.C.; Da Luz E Gorgonio F.; De Paula Canuto A.M.","Vale, Karliane Medeiros Ovidio (25634842700); Gorgonio, Arthur Costa (57203487741); Da Luz E Gorgonio, Flavius (56910052100); De Paula Canuto, Anne Magaly (15022041200)","25634842700; 57203487741; 56910052100; 15022041200","An Efficient Approach to Select Instances in Self-Training and Co-Training Semi-Supervised Methods","2022","https://www.scopus.com/inward/record.uri?eid=2-s2.0-85122277958&doi=10.1109%2fACCESS.2021.3138682&partnerID=40&md5=80ac252524abc12030ce37546e7d5cc6"
"Melo M.; Aquino G.","Melo, Mário (57190188657); Aquino, Gibeon (35787927400)","57190188657; 35787927400","Fatema: A framework for multi-layer fault tolerance in iot systems","2021","https://www.scopus.com/inward/record.uri?eid=2-s2.0-85118174455&doi=10.3390%2fs21217181&partnerID=40&md5=c5ef6b166cd8c7011a4a19d6b59971ca"
"Silva I.B.; de Araújo D.M.; Vocciante M.; Ferro S.; Martínez-Huitle C.A.; Dos Santos E.V.","Silva, Iasmin B. (57222424467); de Araújo, Danyelle Medeiros (55225187900); Vocciante, Marco (55967170900); Ferro, Sergio (7003993673); Martínez-Huitle, Carlos A. (6507655813); Dos Santos, Elisama V. (57213395188)","57222424467; 55225187900; 55967170900; 7003993673; 6507655813; 57213395188","Electrochemical determination of lead using a composite sensor obtained from low-cost green materials: Graphite/cork","2021","https://www.scopus.com/inward/record.uri?eid=2-s2.0-85102680808&doi=10.3390%2fapp11052355&partnerID=40&md5=c65e9da4121a6cafd490bc4a78ea6b5f"
"Barra M.T.M.; Santos M.S.; De Souza V.R.F.B.; Costa F.B.; Barros L.S.; Liu Y.","Barra, Mikaela T. M. (57427510300); Santos, Maxwel S. (57426690300); De Souza, Victor R. F. B. (57239686600); Costa, Flavio B. (22333585200); Barros, Luciano S. (55493359300); Liu, Yunting (56673917800)","57427510300; 57426690300; 57239686600; 22333585200; 55493359300; 56673917800","Comparison between Two-Level and Modular Multilevel Converters in High Voltage Direct Current Systems under Fault Conditions","2021","https://www.scopus.com/inward/record.uri?eid=2-s2.0-85123504983&doi=10.1109%2fWCNPS53648.2021.9626296&partnerID=40&md5=8a1a265518f5c565e5e46458536f8663"
"Goes C.B.D.; Canabarro A.; Duzzioni E.I.; Maciel T.O.","Goes, Caio B. D. (57222297183); Canabarro, Askery (56690175400); Duzzioni, Eduardo I. (8902509200); Maciel, Thiago O. (34980037200)","57222297183; 56690175400; 8902509200; 34980037200","Automated machine learning can classify bound entangled states with tomograms","2021","https://www.scopus.com/inward/record.uri?eid=2-s2.0-85102190139&doi=10.1007%2fs11128-021-03037-9&partnerID=40&md5=641b2b330722c7b95e38a96e755a98c9"
"Pimentel J.M.; Moioli R.C.; de Araujo M.F.P.; Ranieri C.M.; Romero R.A.F.; Broz F.; Vargas P.A.","Pimentel, Jhielson M. (57209482289); Moioli, Renan C. (13006817400); de Araujo, Mariana F. P. (36571660500); Ranieri, Caetano M. (55662436600); Romero, Roseli A. F. (24465478300); Broz, Frank (59176955200); Vargas, Patricia A. (55146997400)","57209482289; 13006817400; 36571660500; 55662436600; 24465478300; 59176955200; 55146997400","Neuro4PD: An Initial Neurorobotics Model of Parkinson's Disease","2021","https://www.scopus.com/inward/record.uri?eid=2-s2.0-85110513587&doi=10.3389%2ffnbot.2021.640449&partnerID=40&md5=08ff6958cbd0532af0e464879b20695f"
"Cavalcante E.; Capilla R.; Drira K.; Bosch J.","Cavalcante, Everton (54893538400); Capilla, Rafael (8931696900); Drira, Khalil (6601972872); Bosch, Jan (56675290800)","54893538400; 8931696900; 6601972872; 56675290800","Message from the SESoS/WDES 2021 Workshop Chairs","2021","https://www.scopus.com/inward/record.uri?eid=2-s2.0-85113231267&doi=10.1109%2fSESoS-WDES52566.2021.00005&partnerID=40&md5=4f1f47a4d576d0d1b2386feae36bd06b"
"Do Nascimento T.F.; Salazar A.O.","Do Nascimento, Thiago F. (57476970500); Salazar, Andres O. (7102422753)","57476970500; 7102422753","Impact Analysis of Low-Voltage Ride-Through on the VSG-Based Power Flow Control Applied to Grid-forming DG Systems","2022","https://www.scopus.com/inward/record.uri?eid=2-s2.0-85146143473&doi=10.1109%2fSEPOC54972.2022.9976407&partnerID=40&md5=5adc912893435c289b37b5b81b998e29"
"Rego R.C.B.; de Araújo F.M.U.","Rego, Rosana C.B. (57216762803); de Araújo, Fábio Meneghetti U. (35316777100)","57216762803; 35316777100","Lyapunov-based continuous-time nonlinear control using deep neural network applied to underactuated systems","2022","https://www.scopus.com/inward/record.uri?eid=2-s2.0-85118488743&doi=10.1016%2fj.engappai.2021.104519&partnerID=40&md5=4dcc1cda532defb91e8000a613cad87d"
"Richards J.; Gechev A.; Alexander J.; Macedo L.; May K.A.; Lindley S.B.","Richards, Jim (55337584100); Gechev, Antonin (57205714691); Alexander, Jill (57035681800); Macedo, Liane (56401675100); May, Karen A. (56516277700); Lindley, Steven B. (57211485244)","55337584100; 57205714691; 57035681800; 56401675100; 56516277700; 57211485244","The effect of local cooling at the elbow on nerve conduction velocity and motor unit behaviour: An exploration of a novel neurological assessment","2021","https://www.scopus.com/inward/record.uri?eid=2-s2.0-85116604478&doi=10.3390%2fs21206703&partnerID=40&md5=27462c5a9a1476b909404198d42b7739"
"Abreu R.S.D.; Nunes Y.T.; Guedes L.A.; Silva I.","Abreu, Rute Souza de (57273036400); Nunes, Yuri Thomas (57192951878); Guedes, Luiz Affonso (35761038800); Silva, Ivanovitch (36537969500)","57273036400; 57192951878; 35761038800; 36537969500","A method for detecting causal relationships between industrial alarm variables using Transfer Entropy and K2 algorithm","2021","https://www.scopus.com/inward/record.uri?eid=2-s2.0-85115785031&doi=10.1016%2fj.jprocont.2021.09.001&partnerID=40&md5=ad519a23b420c4d8a7c44713c053a04f"
"Farias J.W.; Nascimento D.V.C.; Barros T.; Xavier-De-Souza S.","Farias, Johannes W. (57976136000); Nascimento, Diego V. C. (57415823300); Barros, Tiago (57212082760); Xavier-De-Souza, Samuel (59170006300)","57976136000; 57415823300; 57212082760; 59170006300","Speculative guardband: exploiting critical-delay variations across cached instructions","2022","https://www.scopus.com/inward/record.uri?eid=2-s2.0-85142444395&doi=10.1109%2fVLSI-SoC54400.2022.9939597&partnerID=40&md5=276519d96a05ff4edf9780721f4a2e5b"
"Rodríguez-Rodríguez G.; Ballesteros H.M.; Martínez-Cabrera H.; Vilela R.; Pennino M.G.; Bellido J.M.","Rodríguez-Rodríguez, Gonzalo (25626359700); Ballesteros, Hugo M. (57200674822); Martínez-Cabrera, Helena (57219471691); Vilela, Raúl (36619343600); Pennino, María Grazia (40762087900); Bellido, José María (7003268719)","25626359700; 57200674822; 57219471691; 36619343600; 40762087900; 7003268719","On the role of perception: Understanding stakeholders’ collaboration in natural resources management through the evolutionary theory of innovation","2021","https://www.scopus.com/inward/record.uri?eid=2-s2.0-85103545281&doi=10.3390%2fsu13063564&partnerID=40&md5=16cecf0ae024aa15e6a3d062e226bef2"
"Leite D.L.; Alsina P.J.; Campos M.M.M.; de Sousa V.A., Jr.; de Medeiros A.A.M.","Leite, Deyvid L. (57211641026); Alsina, Pablo Javier (6603627735); Campos, Millena M. de Medeiros (57382309000); de Sousa, Vicente A. (6603844872); de Medeiros, Alvaro A. M. (15924771000)","57211641026; 6603627735; 57382309000; 6603844872; 15924771000","Unmanned aerial vehicle propagation channel over vegetation and lake areas: First-and second-order statistical analysis","2022","https://www.scopus.com/inward/record.uri?eid=2-s2.0-85121529508&doi=10.3390%2fs22010065&partnerID=40&md5=1bd770ddfdf25e316d0f0109008a2b84"
"Souza A.L.R.; Gamino M.; Ferreira A.; de Oliveira A.B.; Vaz F.; Bohn F.; Correa M.A.","Souza, Arthur L. R. (57193564521); Gamino, Matheus (23984425900); Ferreira, Armando (26767659000); de Oliveira, Alexandre B. (36501298400); Vaz, Filipe (56488157400); Bohn, Felipe (14420660900); Correa, Marcio A. (55849443600)","57193564521; 23984425900; 26767659000; 36501298400; 56488157400; 14420660900; 55849443600","Directional field-dependence of magnetoimpedance effect on integrated yig/pt-stripline system","2021","https://www.scopus.com/inward/record.uri?eid=2-s2.0-85114689478&doi=10.3390%2fs21186145&partnerID=40&md5=839116d43597f8d2be2df0981ae5a0b2"
"Clayman S.; Neto A.; Verdi F.; Correa S.; Sampaio S.; Sakelariou I.; Mamatas L.; Pasquini R.; Cardoso K.; Tusa F.; Rothenberg C.; Serrat J.","Clayman, Stuart (35217494700); Neto, Augusto (35105652600); Verdi, Fábio (8409980200); Correa, Sand (24823748900); Sampaio, Silvio (35194739400); Sakelariou, Ilias (55925115600); Mamatas, Lefteris (14422440700); Pasquini, Rafael (15042945800); Cardoso, Kleber (6603155158); Tusa, Francesco (35106246600); Rothenberg, Christian (24329881300); Serrat, Joan (6602405182)","35217494700; 35105652600; 8409980200; 24823748900; 35194739400; 55925115600; 14422440700; 15042945800; 6603155158; 35106246600; 24329881300; 6602405182","The NECOS Approach to End-to-End Cloud-Network Slicing as a Service","2021","https://www.scopus.com/inward/record.uri?eid=2-s2.0-85105624700&doi=10.1109%2fMCOM.001.2000702&partnerID=40&md5=ddd63d855fa14b1e070bd8ef3160c1d4"
"Chaves R.; Moreno G.; Polino E.; Poderini D.; Agresti I.; Suprano A.; Barros M.R.; Carvacho G.; Wolfe E.; Canabarro A.; Spekkens R.W.; Sciarrino F.","Chaves, Rafael (23977564500); Moreno, George (57219781378); Polino, Emanuele (57196063259); Poderini, Davide (57197748232); Agresti, Iris (57199226910); Suprano, Alessia (57205578937); Barros, Mariana R. (36679691500); Carvacho, Gonzalo (55951448600); Wolfe, Elie (55324585900); Canabarro, Askery (56690175400); Spekkens, Robert W. (6602168730); Sciarrino, Fabio (6602069713)","23977564500; 57219781378; 57196063259; 57197748232; 57199226910; 57205578937; 36679691500; 55951448600; 55324585900; 56690175400; 6602168730; 6602069713","Causal Networks and Freedom of Choice in Bell's Theorem","2021","https://www.scopus.com/inward/record.uri?eid=2-s2.0-85121768278&doi=10.1103%2fPRXQuantum.2.040323&partnerID=40&md5=c14a53909deebdf49cda52933e9ec1d2"
"Batista C.; Proenca B.; Cavalcante E.; Batista T.; Morais F.; Medeiros H.","Batista, Cesar (57206660384); Proenca, Bruno (57866636500); Cavalcante, Everton (54893538400); Batista, Thais (36812228000); Morais, Felipe (57866227000); Medeiros, Henrique (57866836800)","57206660384; 57866636500; 54893538400; 36812228000; 57866227000; 57866836800","Towards a Multi-Tenant Microservice Architecture: An Industrial Experience","2022","https://www.scopus.com/inward/record.uri?eid=2-s2.0-85136983518&doi=10.1109%2fCOMPSAC54236.2022.00100&partnerID=40&md5=9454d6049e8afe90b1df1d6f62bda1cc"
"Aquino M.B.L.; Guimaraes J.P.F.; Fontes A.I.R.; Linhares L.L.S.; Rego J.B.A.; Martins A.D.M.","Aquino, Manoel B. L. (57211804765); Guimaraes, Joao P. F. (57190426813); Fontes, Aluisio I. R. (55763633400); Linhares, Leandro L. S. (56028590400); Rego, Joilson B. A. (56702327300); Martins, Allan De M. (57985251100)","57211804765; 57190426813; 55763633400; 56028590400; 56702327300; 57985251100","Circular Correntropy: Definition and Application in Impulsive Noise Environments","2022","https://www.scopus.com/inward/record.uri?eid=2-s2.0-85132070416&doi=10.1109%2fACCESS.2022.3178423&partnerID=40&md5=508fd95a3e53f6f1c435eb49e1d26a4b"
"De Souza V.R.F.B.; Barros L.S.; Costa F.B.; Junior G.P.D.S.","De Souza, Victor Ramon F. B. (57239686600); Barros, Luciano S. (55493359300); Costa, Flavio B. (22333585200); Junior, Guilherme P. Da Silva (57743262900)","57239686600; 55493359300; 22333585200; 57743262900","Doubly Fed Induction Generator Low Voltage Ride Through Improvement Through Modular Multilevel Converter","2022","https://www.scopus.com/inward/record.uri?eid=2-s2.0-85131713186&doi=10.1109%2fACCESS.2022.3178960&partnerID=40&md5=413362ea855fc8557edcef6731bd7729"
