"Authors","Author full names","Author(s) ID","Title","Year","Link"
"Campos A.; Batista E.; Signoretti A.; Gardiman R.; Madeira C.","Campos, André (15073765300); Batista, Edwyn (57069716200); Signoretti, Alberto (25823374200); Gardiman, Renato (55537016700); Madeira, Charles (12238899000)","15073765300; 57069716200; 25823374200; 55537016700; 12238899000","Gamifying activities in a higher education course","2015","https://www.scopus.com/inward/record.uri?eid=2-s2.0-84955099925&partnerID=40&md5=12f099b1cbbc2252ea94a321d5570175"
"Costa D.G.; Guedes L.A.; Vasques F.; Portugal P.","Costa, Daniel G. (35519411300); Guedes, Luiz Affonso (35761038800); Vasques, Francisco (6603542902); Portugal, Paulo (8528261900)","35519411300; 35761038800; 6603542902; 8528261900","Adaptive monitoring relevance in camera networks for critical surveillance applications","2013","https://www.scopus.com/inward/record.uri?eid=2-s2.0-84890079048&doi=10.1155%2f2013%2f836721&partnerID=40&md5=82806cf276e36f3e995f8a8be6584027"
"Teixeira L.R.L.; Oliveira J.B.; Araujo A.D.","Teixeira, Leonardo R. L. (55139678300); Oliveira, Josenalde B. (7202553856); Araujo, Aldayr D. (14015206500)","55139678300; 7202553856; 14015206500","Stability Analysis of Indirect Binary Model Reference Adaptive Controller for Plants with Relative Degree One","2015","https://www.scopus.com/inward/record.uri?eid=2-s2.0-84937216681&doi=10.1007%2fs40313-015-0185-3&partnerID=40&md5=fecc72522a3f98edf447d60b968d6ff4"
"Costa D.G.; Guedes L.A.; Vasques F.; Portugal P.","Costa, Daniel G. (35519411300); Guedes, Luiz Affonso (35761038800); Vasques, Francisco (6603542902); Portugal, Paulo (8528261900)","35519411300; 35761038800; 6603542902; 8528261900","Multimedia transmission in wireless sensor networks","2015","https://www.scopus.com/inward/record.uri?eid=2-s2.0-84957958147&doi=10.4018%2f978-1-4666-8850-6.ch007&partnerID=40&md5=c88d369216d9e856b6ed59cf2daefcdd"
"Severino A.G.V.; Linhares L.L.S.; De Araújo F.M.U.","Severino, Alcemy G. V. (56895829500); Linhares, Leandro L. S. (56028590400); De Araújo, Fábio M. U. (35316777100)","56895829500; 56028590400; 35316777100","Optimal design of digital low pass Finite Impulse Response filter using Particle Swarm Optimization and Bat Algorithm","2015","https://www.scopus.com/inward/record.uri?eid=2-s2.0-84943559889&doi=10.5220%2f0005545902070214&partnerID=40&md5=50071c72053b3e1832aca6e78d13aeb7"
"Mendes C.C.A.; Cunha G.C.L.; Vasilevski M.; Bourguet V.; Catunda S.Y.; Lima R.N.; Barros M.","Mendes, C.C.A. (57213109514); Cunha, G.C.L. (56180373700); Vasilevski, M. (24588139500); Bourguet, V. (8318322400); Catunda, S.Y. (6602674444); Lima, R.N. (57191956097); Barros, M. (57198232170)","57213109514; 56180373700; 24588139500; 8318322400; 6602674444; 57191956097; 57198232170","Specifications for a multi-standard SBCD/ARGOS-3 integrated UHF satellite receiver","2014","https://www.scopus.com/inward/record.uri?eid=2-s2.0-84904552017&doi=10.1109%2fLASCAS.2014.6820286&partnerID=40&md5=8587d84d0bfb722579cd182b2ecb3154"
"Barreto S. J.C.L.; Conceição A.G.S.; Dórea C.E.T.; Martinez L.; De Pieri E.R.","Barreto S., Júlio César Lins (56063718000); Conceição, André Gustavo Scolari (56654976700); Dórea, Carlos E. T. (7004096252); Martinez, Luciana (8271783800); De Pieri, Edson Roberto (6602619695)","56063718000; 56654976700; 7004096252; 8271783800; 6602619695","Design and implementation of model-predictive control with friction compensation on an omnidirectional mobile robot","2014","https://www.scopus.com/inward/record.uri?eid=2-s2.0-84895921583&doi=10.1109%2fTMECH.2013.2243161&partnerID=40&md5=5e121a6ce1480491137a7428ea99f890"
"Fairhurst M.; Erbilek M.; Da Costa-Abreu M.","Fairhurst, Michael (7007162548); Erbilek, Meryem (25824901700); Da Costa-Abreu, Márjory (14038905200)","7007162548; 25824901700; 14038905200","Selective review and analysis of aging effects in biometric system implementation","2015","https://www.scopus.com/inward/record.uri?eid=2-s2.0-85027936513&doi=10.1109%2fTHMS.2014.2376874&partnerID=40&md5=c709117cc0a538d46bd4c6704cf5d90b"
"do Nascimento T.C.S.; de Miranda L.C.","do Nascimento, Tibério César Souza (57828392600); de Miranda, Leonardo Cunha (35228941400)","57828392600; 35228941400","Chronos Ações: Tool to Support Decision Making for Investor of the Stock Exchange; [Chronos Ações: Ferramenta para Apoiar a Tomada de Decisão de Investidores da Bolsa de Valores]","2015","https://www.scopus.com/inward/record.uri?eid=2-s2.0-85063880668&partnerID=40&md5=58c446a2414b6356b9ff07c80121c743"
"Reis A.J.S.; Maitelli A.L.","Reis, Aderson Jamier Santos (56583462300); Maitelli, André Laurindo (6602549353)","56583462300; 6602549353","An Adaptive Suboptimal Control Algorithm with Variable Design Parameter for Systems with Stochastic Parameters","2015","https://www.scopus.com/inward/record.uri?eid=2-s2.0-84929456932&doi=10.1007%2fs40313-015-0176-4&partnerID=40&md5=5eb7a95e71c005fafb6de5be7d05b389"
"Alves D.K.; Neto C.M.S.; Costa F.B.; Ribeiro R.L.A.","Alves, D.K. (56597608500); Neto, C.M.S. (55608630500); Costa, F.B. (22333585200); Ribeiro, R.L.A. (7202534599)","56597608500; 55608630500; 22333585200; 7202534599","Power measurement using the maximal overlap discrete wavelet transform","2014","https://www.scopus.com/inward/record.uri?eid=2-s2.0-84946685499&doi=10.1109%2fINDUSCON.2014.7059455&partnerID=40&md5=fa0ea096f9a5c2f80150a3b185eb0286"
"Do Carmo S.N.; De Almeida M.O.; De Castro F.A.; Campos R.F.R.; Araujo J.M.; Dorea C.E.T.","Do Carmo, Samronne N. (56237843000); De Almeida, Marconi O. (55963972900); De Castro, Flavio A. (57209445985); Campos, Rafael F.R. (58404796700); Araujo, Jose M. (36808912600); Dorea, Carlos E. T. (7004096252)","56237843000; 55963972900; 57209445985; 58404796700; 36808912600; 7004096252","Neural network fitting for input-output manifolds of online control laws in constrained linear systems","2014","https://www.scopus.com/inward/record.uri?eid=2-s2.0-84922927990&doi=10.1109%2fCICA.2014.7013246&partnerID=40&md5=7c227756b121269045864272b5eff5f0"
"Da Costa Martins J.K.E.; De Araújo F.M.U.","Da Costa Martins, José Kleiton Ewerton (57214422700); De Araújo, Fábio Meneghetti Ugulino (35316777100)","57214422700; 35316777100","Nonlinear system identification based on modified ANFIS","2015","https://www.scopus.com/inward/record.uri?eid=2-s2.0-84943546868&doi=10.5220%2f0005544905880595&partnerID=40&md5=fb4399559da05f5772eece1f2acd3ed9"
"Abinader F.M., Jr.; Almeida E.P.L.; Chaves F.S.; Cavalcante A.M.; Vieira R.D.; Paiva R.C.D.; Sobrinho A.M.; Choudhury S.; Tuomaala E.; Doppler K.; Sousa V.A., Jr.","Abinader, Fuad M. (55762821500); Almeida, Erika P. L. (55204048400); Chaves, Fabiano S. (8284527400); Cavalcante, André M. (15925100000); Vieira, Robson D. (56231906400); Paiva, Rafael C. D. (36642841900); Sobrinho, Angilberto M. (56439300200); Choudhury, Sayantan (57198392529); Tuomaala, Esa (23391153700); Doppler, Klaus (15623233300); Sousa, Vicente A. (6603844872)","55762821500; 55204048400; 8284527400; 15925100000; 56231906400; 36642841900; 56439300200; 57198392529; 23391153700; 15623233300; 6603844872","Enabling the coexistence of LTE and Wi-Fi in unlicensed bands","2014","https://www.scopus.com/inward/record.uri?eid=2-s2.0-84915752834&doi=10.1109%2fMCOM.2014.6957143&partnerID=40&md5=c6d55e48eda5ba178ee5534159024d1d"
"De Sousa T.F.B.; Fernandesy M.A.C.","De Sousa, Tiago F.B. (56258397000); Fernandesy, Marcelo A.C. (57220883161)","56258397000; 57220883161","Multilayer perceptron equalizer for optical communication systems","2014","https://www.scopus.com/inward/record.uri?eid=2-s2.0-84904857641&partnerID=40&md5=176450f2f5a3adf4e8a7260a10a7fa64"
"De Souza D.C.; Neto A.D.D.; Guedes L.A.","De Souza, Danilo Curvelo (56597609100); Neto, Adrião Duarte Dória (7102618949); Guedes, Luiz Affonso (35761038800)","56597609100; 7102618949; 35761038800","Trend-weighted rule-based expert system for process diagnosis","2014","https://www.scopus.com/inward/record.uri?eid=2-s2.0-84946691960&doi=10.1109%2fETFA.2014.7005325&partnerID=40&md5=8f15be920acb3ccf0bee5d127aa863e8"
"Artigau E.; Kouach D.; Donati J.-F.; Doyon R.; Delfosse X.; Baratchart S.; Lacombe M.; Moutou C.; Rabou P.; Parès L.P.; Micheau Y.; Thibault S.; Reshetov V.A.; Dubois B.; Hernandez O.; Vallée P.; Wang S.-Y.; Dolon F.; Pepe F.A.; Bouchy F.; Striebig N.; Hénault F.; Loop D.; Saddlemyer L.; Barrick G.; Vermeulen T.; Dupieux M.; Hébrard G.; Boisse I.; Martioli E.; Alencar S.H.P.; Do Nascimento J.-D.; Figueira P.","Artigau, Étienne (6505850637); Kouach, Driss (6508102066); Donati, Jean-François (55944022800); Doyon, René (7004341868); Delfosse, Xavier (6701872272); Baratchart, Sébastien (7801623377); Lacombe, Marielle (56514792900); Moutou, Claire (56227768000); Rabou, Patrick (6603409387); Parès, Laurent P. (6506598191); Micheau, Yoan (6505697973); Thibault, Simon (7007156921); Reshetov, Vladimir A. (57197584204); Dubois, Bruno (59063741800); Hernandez, Olivier (7005774382); Vallée, Philippe (6701702937); Wang, Shiang-Yu (7410335642); Dolon, François (6506131720); Pepe, Francesco A. (9532342600); Bouchy, François (6603747336); Striebig, Nicolas (55252387900); Hénault, François (6602636879); Loop, David (14825489500); Saddlemyer, Leslie (6603169413); Barrick, Gregory (6602386994); Vermeulen, Tom (7004727176); Dupieux, Michel (56957030200); Hébrard, Guillaume (7004329244); Boisse, Isabelle (23988784400); Martioli, Eder (23088615800); Alencar, Silvia H. P. (6701650036); Do Nascimento, José-Diaz (7004473705); Figueira, Pedro (25031284400)","6505850637; 6508102066; 55944022800; 7004341868; 6701872272; 7801623377; 56514792900; 56227768000; 6603409387; 6506598191; 6505697973; 7007156921; 57197584204; 59063741800; 7005774382; 6701702937; 7410335642; 6506131720; 9532342600; 6603747336; 55252387900; 6602636879; 14825489500; 6603169413; 6602386994; 7004727176; 56957030200; 7004329244; 23988784400; 23088615800; 6701650036; 7004473705; 25031284400","SPIRou: The near-infrared spectropolarimeter/high-precision velocimeter for the Canada-France-Hawaii telescope","2014","https://www.scopus.com/inward/record.uri?eid=2-s2.0-84922733605&doi=10.1117%2f12.2055663&partnerID=40&md5=66493cf59d7268643eb527e9c0d1f019"
"Mota L.O.; Rocha K.A.; Souza T.X.R.; Jesus E.; Oliveira Junior A.M.; Soletti J.I.; Carvalho S.H.V.; Souza D.F.","Mota, L.O. (56857302300); Rocha, K.A. (56857322000); Souza, T.X.R. (57191519625); Jesus, E. (55364735800); Oliveira Junior, A.M. (56857469900); Soletti, J.I. (6508265000); Carvalho, S.H.V. (7005619842); Souza, D.F. (55312444500)","56857302300; 56857322000; 57191519625; 55364735800; 56857469900; 6508265000; 7005619842; 55312444500","The ant colony optimization algorithm for offshore air transport in the northeast of Brazil","2014","https://www.scopus.com/inward/record.uri?eid=2-s2.0-84941966122&doi=10.1201%2fb17488-133&partnerID=40&md5=13c9dcdc75c570566c96f433db7b97e0"
"Pereira Dimuro G.; Bedregal B.","Pereira Dimuro, Graçaliz (6508226260); Bedregal, Benjamín (15520790700)","6508226260; 15520790700","On residual implications derived from overlap functions","2015","https://www.scopus.com/inward/record.uri?eid=2-s2.0-84928349436&doi=10.1016%2fj.ins.2015.03.049&partnerID=40&md5=2f53efbbfc90d1143cfdd4138ba5d2ce"
"Salazar A.O.; Fonsêca D.A.M.; Martelli A.L.; Fontes F.; De Oliveira Quintaes F.","Salazar, Andres O. (7102422753); Fonsêca, Diego A. M. (36682132200); Martelli, André L. (56597519100); Fontes, Francisco (6602095954); De Oliveira Quintaes, Filipe (56598105700)","7102422753; 36682132200; 56597519100; 6602095954; 56598105700","Instrumentation to detect contamination of insulating oil in motors applied to electrical submersible pump","2014","https://www.scopus.com/inward/record.uri?eid=2-s2.0-84946686890&doi=10.1109%2fINDUSCON.2014.7059440&partnerID=40&md5=2af5a50e7e4ee89515da458d50026d12"
"Andrade A.O.; Trindade R.M.P.; Maia D.S.; Santiago R.H.N.; Guerreiro A.M.G.","Andrade, Alexsandra Oliveira (56566090400); Trindade, Roque Mendes Prado (36807201600); Maia, Deise Santana (58321553100); Santiago, Regivan Hugo Nunes (7006674404); Guerreiro, Ana Maria Guimarães (15055841900)","56566090400; 36807201600; 58321553100; 7006674404; 15055841900","Analysing some R-Implications and its application in fuzzy mathematical morphology","2014","https://www.scopus.com/inward/record.uri?eid=2-s2.0-84925363225&doi=10.3233%2fIFS-130989&partnerID=40&md5=66fdbeb3d26a7e54cb7c47f4bd99f996"
"Costa D.G.; Guedes L.A.; Vasques F.; Portugal P.","Costa, Daniel G. (35519411300); Guedes, Luiz Affonso (35761038800); Vasques, Francisco (6603542902); Portugal, Paulo (8528261900)","35519411300; 35761038800; 6603542902; 8528261900","Relevance-based balanced sink mobility in wireless visual sensor networks","2014","https://www.scopus.com/inward/record.uri?eid=2-s2.0-84914174610&doi=10.1109%2fINDIN.2014.6945495&partnerID=40&md5=714ad58e6cdb29f024a814cc7a11fdc0"
"Da Cruz M.C.S.; De Oliveira J.T.; De Medeiros M.F., Jr.","Da Cruz, Melinda Cesianara Silva (57213933794); De Oliveira, Jose Tavares (21741856900); De Medeiros, Manoel Firmino (6603603627)","57213933794; 21741856900; 6603603627","A Performance Analysis of Methods for Fault Location in Transmission Lines Considering Errors in Data Acquisition","2015","https://www.scopus.com/inward/record.uri?eid=2-s2.0-84942943493&doi=10.1109%2fTLA.2015.7273772&partnerID=40&md5=f3666ab2efb8419fd42b9c7f217f1402"
"Almeida A.; Cavalcante E.; Batista T.; Cacho N.; Lopes F.","Almeida, Andre (35104303100); Cavalcante, Everton (54893538400); Batista, Thais (36812228000); Cacho, Nelio (17433450200); Lopes, Frederico (57193516964)","35104303100; 54893538400; 36812228000; 17433450200; 57193516964","A component-based adaptation approach for multi-cloud applications","2014","https://www.scopus.com/inward/record.uri?eid=2-s2.0-84904508201&doi=10.1109%2fINFCOMW.2014.6849167&partnerID=40&md5=148e5a3160d9bd87d379ffb0dec30596"
"De O. Guimarães A.; Da Silva J.P.; Dantas E.R.M.","De O. Guimarães, Ádller (56666811400); Da Silva, José P. (8776554000); Dantas, Emmanuel R.M. (55925915000)","56666811400; 8776554000; 55925915000","Genetic algorithm applied to control of DC motor with disturbance rejection by feedforward action","2015","https://www.scopus.com/inward/record.uri?eid=2-s2.0-84930344722&doi=10.2316%2fJournal.201.2015.1.201-2599&partnerID=40&md5=6e2274f493fb7f9ddbd45dddb6c027a7"
"Costa D.G.; Silva I.; Guedes L.A.; Portugal P.; Vasques F.","Costa, Daniel G. (35519411300); Silva, Ivanovitch (36537969500); Guedes, Luiz Affonso (35761038800); Portugal, Paulo (8528261900); Vasques, Francisco (6603542902)","35519411300; 36537969500; 35761038800; 8528261900; 6603542902","Selecting redundant nodes when addressing availability in wireless visual sensor networks","2014","https://www.scopus.com/inward/record.uri?eid=2-s2.0-84914177205&doi=10.1109%2fINDIN.2014.6945496&partnerID=40&md5=b6f72a731a43799dc4784e6b5ea31d5a"
"Alves G.; Silva C.; Cavalcante E.; Batista T.; Lopes F.","Alves, Gustavo (55537570400); Silva, Caio (57225671531); Cavalcante, Everton (54893538400); Batista, Thais (36812228000); Lopes, Frederico (57193516964)","55537570400; 57225671531; 54893538400; 36812228000; 57193516964","Relative QoS: A new concept for cloud service quality","2015","https://www.scopus.com/inward/record.uri?eid=2-s2.0-84991013897&doi=10.1109%2fSOSE.2015.43&partnerID=40&md5=701c48520f8d85480f27971e65c3d13d"
"Gonçalves M.B.; Cavalcante E.; Batista T.; Oquendo F.; Nakagawa E.Y.","Gonçalves, Marcelo Benites (55826531800); Cavalcante, Everton (54893538400); Batista, Thais (36812228000); Oquendo, Flavio (6602992155); Nakagawa, Elisa Yumi (7007008701)","55826531800; 54893538400; 36812228000; 6602992155; 7007008701","Towards a conceptual model for software-intensive system-of-systems","2014","https://www.scopus.com/inward/record.uri?eid=2-s2.0-84938057349&doi=10.1109%2fsmc.2014.6974145&partnerID=40&md5=10f99041f61d405bd341177a66f5e122"
"Prado R.N.A.; Oliveira J.A.N.; Melo J.D.; Dória Neto A.D.","Prado, R.N.A. (57197399203); Oliveira, J.A.N. (24724037300); Melo, J.D. (55664205300); Dória Neto, A.D. (7102618949)","57197399203; 24724037300; 55664205300; 7102618949","Takagi hayashi fuzzy neural system in hardware: An application for embedding in industrial sensors, making them intelligent","2014","https://www.scopus.com/inward/record.uri?eid=2-s2.0-84906687178&doi=10.1007%2fs40313-014-0131-9&partnerID=40&md5=c05156948cff3a5cb175df17fc1d1353"
"Dos Santos W.C.; De Souza B.A.; Dantas Brito N.S.; Costa F.B.; Cerqueira Paes Jr. M.R.","Dos Santos, Wellinsílvio Costa (38562157400); De Souza, Benemar Alencar (56249553100); Dantas Brito, Núbia Silva (8701403700); Costa, Flávio Bezerra (22333585200); Cerqueira Paes Jr., Marcelo Renato (55998678300)","38562157400; 56249553100; 8701403700; 22333585200; 55998678300","High impedance faults: From field tests to modeling","2013","https://www.scopus.com/inward/record.uri?eid=2-s2.0-84892148792&doi=10.1007%2fs40313-013-0072-8&partnerID=40&md5=795b8e9ed23000c29ede9bcb4a3279ab"
"Barros R.; Giongo J.S.","Barros, Rodrigo (57196918940); Giongo, José Samuel (6507794665)","57196918940; 6507794665","Locking beam influence on behavior of reinforced concrete two pile caps with embedded socket; [Influência da viga de travamento em blocos de concreto armado sobre duas estacas com cálice embutido]","2014","https://www.scopus.com/inward/record.uri?eid=2-s2.0-84897939490&doi=10.4025%2factascitechnol.v36i2.19285&partnerID=40&md5=ead58c8b7e642678cb9e50684db40372"
"Dias S.; Queiroz K.; Araujo A.","Dias, Samaherni (16177129200); Queiroz, Kurios (24831035000); Araujo, Aldayr (14015206500)","16177129200; 24831035000; 14015206500","Robust Control Applied to Multiple-Input Multiple-Output Nonlinear Systems","2014","https://www.scopus.com/inward/record.uri?eid=2-s2.0-84919948305&doi=10.1007%2fs40313-014-0150-6&partnerID=40&md5=ea2e349f298ce3fb1d709ad0050870b6"
"Costa J.W.C.; de Miranda L.C.","Costa, João Wagner Chaves (57827996800); de Miranda, Leonardo Cunha (35228941400)","57827996800; 35228941400","RateMyDay: Mobile Tool to Follow the Daily Activities; [RateMyDay: Ferramenta Móvel para Acompanhar as Atividades do Cotidiano]","2015","https://www.scopus.com/inward/record.uri?eid=2-s2.0-85135338736&partnerID=40&md5=d445e22bdf37623bdc33da0b870936b2"
"Macedo D.; Guedes L.A.; Silva I.","Macedo, Daniel (8988932700); Guedes, Luiz Affonso (35761038800); Silva, Ivanovitch (36537969500)","8988932700; 35761038800; 36537969500","A dependability evaluation for Internet of Things incorporating redundancy aspects","2014","https://www.scopus.com/inward/record.uri?eid=2-s2.0-84902382938&doi=10.1109%2fICNSC.2014.6819662&partnerID=40&md5=d04b627244a1ca7b8270f27a6448b2e3"
"Araújo M.V.; Alsina P.J.; Cavalcanti Roza V.C.; Melo N.B.","Araújo, Marcio Valerio (56520939100); Alsina, Pablo Javier (6603627735); Cavalcanti Roza, Valber Cesar (24438125300); Melo, Nicholas Bastos (56521226700)","56520939100; 6603627735; 24438125300; 56521226700","Powered orthosis ortholeg: Design and development","2015","https://www.scopus.com/inward/record.uri?eid=2-s2.0-84923106800&doi=10.1109%2fTLA.2015.7040633&partnerID=40&md5=f709822a81f2d11f1592fd3b56181b49"
"Albuquerque H.J.O.; De Aquino Junior G.S., Jr.","Albuquerque, Heldon Jose Oliveira (56340309300); De Aquino Junior, Gibeon Soares (35787927400)","56340309300; 35787927400","A proxy-based solution for interoperability of smart home protocols","2014","https://www.scopus.com/inward/record.uri?eid=2-s2.0-84908887693&doi=10.1109%2fCISIS.2014.96&partnerID=40&md5=7e9fc7d95115d0fd40172ae4214f05ef"
"Lima A.D.D.; Barros C.A.; Silveira L.F.Q.; Xavier-De-Souza S.; Valderrama C.A.","Lima, Arthur D.D. (57203183985); Barros, Carlos A (56023311400); Silveira, Luiz Felipe Q. (56363591700); Xavier-De-Souza, Samuel (59170006300); Valderrama, Carlos A. (6602815648)","57203183985; 56023311400; 56363591700; 59170006300; 6602815648","Parallel cyclostationarity-exploiting algorithm for energy-efficient spectrum sensing","2014","https://www.scopus.com/inward/record.uri?eid=2-s2.0-84893247533&doi=10.1587%2ftranscom.E97.B.326&partnerID=40&md5=734db0190d1bbc76bd1bbcf6408c57eb"
"Macedo D.; Silva I.; Guedes L.A.; Portugal P.; Vasques F.","Macedo, Daniel (8988932700); Silva, Ivanovitch (36537969500); Guedes, Luiz Affonso (35761038800); Portugal, Paulo (8528261900); Vasques, Francisco (6603542902)","8988932700; 36537969500; 35761038800; 8528261900; 6603542902","A framework for dependability evaluation of industrial processes","2013","https://www.scopus.com/inward/record.uri?eid=2-s2.0-84890693525&doi=10.1109%2fETFA.2013.6648117&partnerID=40&md5=b8efe6fc13849a07fdf9fccacef46774"
"Mezzomo I.; Bedregal B.C.; Santiago R.H.N.","Mezzomo, Ivan (55414202100); Bedregal, Benjamín C. (15520790700); Santiago, Regivan H.N. (7006674404)","55414202100; 15520790700; 7006674404","Types of fuzzy ideals in fuzzy lattices","2015","https://www.scopus.com/inward/record.uri?eid=2-s2.0-84921925646&doi=10.3233%2fIFS-141374&partnerID=40&md5=e8f91de31725484f41d08ed5e3c15f33"
"de Azevedo Dantas A.F.O.; Maitelli A.L.; da Silva Linhares L.L.; de Araujo F.M.U.","de Azevedo Dantas, Andre Felipe Oliveira (57203395728); Maitelli, Andre Laurindo (6602549353); da Silva Linhares, Leandro Luttiane (56532488400); de Araujo, Fabio Meneghetti Ugulino (35316777100)","57203395728; 6602549353; 56532488400; 35316777100","A Modified Matricial PSO Algorithm Applied to System Identification with Convergence Analysis","2015","https://www.scopus.com/inward/record.uri?eid=2-s2.0-84923842632&doi=10.1007%2fs40313-014-0160-4&partnerID=40&md5=76650974b9785a807e871cc06626af3c"
"Da Silva G.S.; Mattozo T.C.; Costa J.A.F.; Fernandes Neto A.P.; De França R.L.S.","Da Silva, Gutembergue Soares (55337051300); Mattozo, Teófilo Camara (55336990600); Costa, José Alfredo Ferreira (7402460809); Fernandes Neto, André Pedro (55336664000); De França, Ricardo Luiz Soares (55019991100)","55337051300; 55336990600; 7402460809; 55336664000; 55019991100","Mobile Communications Market Segmentation: An Analysis of Data Combining Self-organizing Maps and Structural Equation Modeling","2015","https://www.scopus.com/inward/record.uri?eid=2-s2.0-84942764729&doi=10.1109%2fTLA.2015.7273803&partnerID=40&md5=4552bd85775caeb3b7d1c3497a7c9af9"
"Denis Mendonca Oliveira F.; Soares Semente R.; Doolan Fernandes J.; Augusto Correia Melo T.; Ortiz Salazar A.","Denis Mendonca Oliveira, Felipe (56644868500); Soares Semente, Rodrigo (56105065700); Doolan Fernandes, Jefferson (56785091400); Augusto Correia Melo, Talison (59159806400); Ortiz Salazar, Andres (7102422753)","56644868500; 56105065700; 56785091400; 59159806400; 7102422753","SEREE: An energy-efficient wireless sensor network embedded system to be applied on plunger lift oil elevation method","2015","https://www.scopus.com/inward/record.uri?eid=2-s2.0-84929378501&doi=10.1109%2fTLA.2015.7106374&partnerID=40&md5=068c5aed22ddf4e2fe83ff3e42826752"
"Bustince H.; Galar M.; Bedregal B.; Koleśarov́a A.; Mesiar R.","Bustince, Humberto (55034746100); Galar, Mikel (35731257600); Bedregal, Benjamin (15520790700); Koleśarov́a, Anna (55917658200); Mesiar, Radko (7004621213)","55034746100; 35731257600; 15520790700; 55917658200; 7004621213","A new approach to interval-valued choquet integrals and the problem of ordering in interval-valued fuzzy set applications","2013","https://www.scopus.com/inward/record.uri?eid=2-s2.0-84897584161&doi=10.1109%2fTFUZZ.2013.2265090&partnerID=40&md5=ca7679c36596da9cfad11c3ad9f47507"
"da Silva M.C.C.; Sens M.L.; Soares C.; Neto C.O.A.","da Silva, Márcio Claudio Cardoso (55834016600); Sens, Maurício Luiz (15027498900); Soares, Clarissa (55978302700); Neto, Cícero Onofre de Andrade (55977833400)","55834016600; 15027498900; 55978302700; 55977833400","Water purification by direct solar distillation process in isolated households; [Potabilização de água por processo de destilação solar direta para residências isoladas]","2014","https://www.scopus.com/inward/record.uri?eid=2-s2.0-84891304408&doi=10.4025%2factascitechnol.v36i1.18737&partnerID=40&md5=9802734ad923195ba486cf9f02ed98e8"
"Vitor Silva P.; Ferreira Pinheiro R.; Ortiz Salazar A.; Pereira Do Santos Junior L.; Cesar De Azevedo C.","Vitor Silva, Paulo (56644759500); Ferreira Pinheiro, Ricardo (7004083401); Ortiz Salazar, Andres (7102422753); Pereira Do Santos Junior, Luciano (56644825500); Cesar De Azevedo, Christian (56644771200)","56644759500; 7004083401; 7102422753; 56644825500; 56644771200","A proposal for a new wind turbine topology using an electromagnetic frequency regulator","2015","https://www.scopus.com/inward/record.uri?eid=2-s2.0-84929376448&doi=10.1109%2fTLA.2015.7106347&partnerID=40&md5=776585c2e70aa102c2f4152e3a26a6e5"
