"Authors","Author full names","Author(s) ID","Title","Year","Link"
"Farias M.S.; Mendes W.R.; Araújo F.M.U.","Farias, Missilene S. (57211586590); Mendes, Willians R. (7003469946); Araújo, Fábio M.U. (35316777100)","57211586590; 7003469946; 35316777100","Interval type-2 fuzzy servo controller for state feedback of nonlinear systems","2019","https://www.scopus.com/inward/record.uri?eid=2-s2.0-85074469794&doi=10.3233%2fJIFS-190537&partnerID=40&md5=a57f523bfd8a47d81a87ec3ee702218f"
"Silva D.; Nogueira M.; Rodrigues M.; Silva I.; Ferrari P.; Sisinni E.","Silva, Diego (24722389500); Nogueira, Marcelo (50661492500); Rodrigues, Marconi (57203639001); Silva, Ivanovitch (36537969500); Ferrari, Paolo (57195277194); Sisinni, Emiliano (24777116800)","24722389500; 50661492500; 57203639001; 36537969500; 57195277194; 24777116800","Implementation of a dependable smart device in IoT era","2019","https://www.scopus.com/inward/record.uri?eid=2-s2.0-85081616543&doi=10.1109%2fLADC48089.2019.8995733&partnerID=40&md5=d0d1931f9d32d7ac58d0474c07df147b"
"De Freitas Nunes E.A.; Salazar A.O.; Villarreal E.R.L.; Souza F.E.C.; Dos Santos L.P., Jr.; Lopes J.S.B.; Luque J.C.C.","De Freitas Nunes, Evandro Ailson (57655209200); Salazar, Andrés Ortiz (7102422753); Villarreal, Elmer Rolando Llanos (55361069800); Souza, Francisco Elvis Carvalho (56439013400); Dos Santos, Luciano Pereira (57194048651); Lopes, José Soares Batista (55104256700); Luque, Juan Carlos Cutipa (44860941900)","57655209200; 7102422753; 55361069800; 56439013400; 57194048651; 55104256700; 44860941900","Proposal of a fuzzy controller for radial position in a bearingless induction motor","2019","https://www.scopus.com/inward/record.uri?eid=2-s2.0-85075576948&doi=10.1109%2fACCESS.2019.2934820&partnerID=40&md5=8c4ffa5ef158d8ad577dd588d08e41c9"
"Cardoso L.S.; De Rocha T.O.A.; Ribeiro R.L.A.; Pinheiro J.R.; Neto J.R.D.","Cardoso, L.S. (57215349768); De Rocha, T.O.A. (57215342417); Ribeiro, R.L.A. (7202534599); Pinheiro, J.R. (7102840600); Neto, J.R.D. (57215314720)","57215349768; 57215342417; 7202534599; 7102840600; 57215314720","Improvements on Power Flow Control of Voltage-Source-Based Grid-Supporting Converter by Using Virtual Impedance Concept","2019","https://www.scopus.com/inward/record.uri?eid=2-s2.0-85075735277&doi=10.1109%2fISGT-LA.2019.8895433&partnerID=40&md5=1adebf11fc2ad8e9217282dc379b24ea"
"Junior J.C.V.S.; Torquato M.F.; Noronha D.H.; Silva S.N.; Fernandes M.A.C.","Junior, José C. V. S. (56734196500); Torquato, Matheus F. (57195314921); Noronha, Daniel H. (57202047395); Silva, Sérgio N. (56402497700); Fernandes, Marcelo A. C. (7202947679)","56734196500; 57195314921; 57202047395; 56402497700; 7202947679","Proposal of the tactile glove device","2019","https://www.scopus.com/inward/record.uri?eid=2-s2.0-85075104034&doi=10.3390%2fs19225029&partnerID=40&md5=bcdaeb349e7fcf181cb321d09237a39d"
"Santos L.; Pereira J.; Silva E.; Batista T.; Cavalcante E.; Leite J.","Santos, Lidiane (57202100718); Pereira, Jorge (57188923143); Silva, Eduardo (42561692600); Batista, Thais (36812228000); Cavalcante, Everton (54893538400); Leite, Jair (23392964600)","57202100718; 57188923143; 42561692600; 36812228000; 54893538400; 23392964600","Identifying Requirements for Architectural Modeling in Internet of Things Applications","2019","https://www.scopus.com/inward/record.uri?eid=2-s2.0-85066469066&doi=10.1109%2fICSA-C.2019.00011&partnerID=40&md5=0324270e05e6cdde1cacfa930750b0ba"
"Carmo M.; Dantas Silva F.S.; Neto A.V.; Corujo D.; Aguiar R.","Carmo, Maxweel (14036971600); Dantas Silva, Felipe S. (56393770300); Neto, Augusto Venâncio (35105652600); Corujo, Daniel (23008345900); Aguiar, Rui (7006635816)","14036971600; 56393770300; 35105652600; 23008345900; 7006635816","Network-cloud slicing definitions for wi-fi sharing systems to enhance 5g ultra dense network capabilities","2019","https://www.scopus.com/inward/record.uri?eid=2-s2.0-85062325950&doi=10.1155%2f2019%2f8015274&partnerID=40&md5=5073e876191a105718f4ad2441267e64"
"Noor A.; Mitra K.; Solaiman E.; Souza A.; Jha D.N.; Demirbaga U.; Jayaraman P.P.; Cacho N.; Ranjan R.","Noor, Ayman (57207470285); Mitra, Karan (35792520400); Solaiman, Ellis (6506642705); Souza, Arthur (57158624600); Jha, Devki Nandan (57189293843); Demirbaga, Umit (57205485516); Jayaraman, Prem Prakash (24824284200); Cacho, Nelio (17433450200); Ranjan, Rajiv (57197711780)","57207470285; 35792520400; 6506642705; 57158624600; 57189293843; 57205485516; 24824284200; 17433450200; 57197711780","Cyber-physical application monitoring across multiple clouds","2019","https://www.scopus.com/inward/record.uri?eid=2-s2.0-85067390602&doi=10.1016%2fj.compeleceng.2019.06.007&partnerID=40&md5=3e89ef169534aacdbd97aaedc78ceee5"
"De Souza P.T.V.; Fontes A.I.R.; De Souza V.S.V.; Silveira L.F.","De Souza, Pedro T. V. (56257393800); Fontes, Aluisio I. R. (55763633400); De Souza, Vinicius S. V. (36684980400); Silveira, Luiz F. (56363591700)","56257393800; 55763633400; 36684980400; 56363591700","A Novel Signal Detector in MIMO Systems Based on Complex Correntropy","2019","https://www.scopus.com/inward/record.uri?eid=2-s2.0-85078225245&doi=10.1109%2fACCESS.2019.2942822&partnerID=40&md5=495b2e0099e205171414d367b55eda20"
"Sousa G.C.; Queiroz C.M.; Sousa P.; Lima P.; da Silva A.A.M.; Pires N.; Barros A.K.","Sousa, Gean Carlos (57208014517); Queiroz, Claudio M. (16444442500); Sousa, Patrícia (57188923292); Lima, Priscila (57192674643); da Silva, Antônio Augusto Moura (35553371900); Pires, Nilviane (57191504621); Barros, Allan Kardec (7102745164)","57208014517; 16444442500; 57188923292; 57192674643; 35553371900; 57191504621; 7102745164","Identification of hypsarrhythmia in children with microcephaly infected by zika virus","2019","https://www.scopus.com/inward/record.uri?eid=2-s2.0-85063575469&doi=10.3390%2fe21030232&partnerID=40&md5=c01bf965245031dc5d3f21083b8e05a6"
"Castillo-Lema J.; Venancio Neto A.; De Oliveira F.; Takeo Kofuji S.","Castillo-Lema, Jose (55612016500); Venancio Neto, Augusto (35105652600); De Oliveira, Flavio (37123860700); Takeo Kofuji, Sergio (6603630423)","55612016500; 35105652600; 37123860700; 6603630423","Mininet-nfv: Evolving mininet with oasis tosca nvf profiles towards reproducible nfv prototyping","2019","https://www.scopus.com/inward/record.uri?eid=2-s2.0-85072015417&doi=10.1109%2fNETSOFT.2019.8806686&partnerID=40&md5=b0d72ae306ecbcd904dc967b9c20b029"
"Batista I.D.S.; Sardina I.M.; Dantas R.R.","Batista, Isaac Danilo Santos (57210812202); Sardina, Idalmis Milian (36171042800); Dantas, Rummenigge Rudson (24823999700)","57210812202; 36171042800; 24823999700","Monitoring Restaurants in Real-Time","2019","https://www.scopus.com/inward/record.uri?eid=2-s2.0-85071566684&doi=10.1109%2fMETROI4.2019.8792882&partnerID=40&md5=8283db2a49f22bac1ad7c6094dbfe7cb"
"Silva F.S.D.; Lemos M.O.O.; Medeiros A.; Neto A.V.; Pasquini R.; Moura D.; Rothenberg C.; Mamatas L.; Correa S.L.; Cardoso K.V.; Marcondes C.; Abelem A.; Nascimento M.; Galis A.; Contreras L.; Serrat J.; Papadimitriou P.","Silva, Felipe S. Dantas (56393770300); Lemos, Marcilio O. O. (57204066006); Medeiros, Alisson (57204072243); Neto, Augusto Venancio (35105652600); Pasquini, Rafael (15042945800); Moura, David (59028430500); Rothenberg, Christian (24329881300); Mamatas, Lefteris (14422440700); Correa, Sand Luz (24823748900); Cardoso, Kleber Vieira (6603155158); Marcondes, Cesar (15923534300); Abelem, Antonio (6505971129); Nascimento, Marcelo (36617821300); Galis, Alex (6603596791); Contreras, Luis (56028722900); Serrat, Joan (6602405182); Papadimitriou, Panagiotis (13411139900)","56393770300; 57204066006; 57204072243; 35105652600; 15042945800; 59028430500; 24329881300; 14422440700; 24823748900; 6603155158; 15923534300; 6505971129; 36617821300; 6603596791; 56028722900; 6602405182; 13411139900","NECOS Project: Towards Lightweight Slicing of Cloud Federated Infrastructures","2018","https://www.scopus.com/inward/record.uri?eid=2-s2.0-85054364628&doi=10.1109%2fNETSOFT.2018.8460008&partnerID=40&md5=c3ed6c995d1127738d802bad95344bf9"
"Santos C.H.F.; Silva F.S.D.; Neto A.J.V.","Santos, Charles H. F. (57200504297); Silva, Felipe S. Dantas (56393770300); Neto, Augusto J. Venâncio (35105652600)","57200504297; 56393770300; 35105652600","An innovative dynamic bit rate streaming approach to improve mobile user multimedia quality of experience","2017","https://www.scopus.com/inward/record.uri?eid=2-s2.0-85047992298&doi=10.1145%2f3132062.3132072&partnerID=40&md5=cebf85ba586eee0256ff05cd1f5463be"
"De Miguel L.; Santos H.; Sesma-Sara M.; Bedregal B.; Jurio A.; Bustince H.; Hagras H.","De Miguel, Laura (56297256800); Santos, Helida (16644066900); Sesma-Sara, Mikel (57193229998); Bedregal, Benjamin (15520790700); Jurio, Aranzazu (35748840700); Bustince, Humberto (55034746100); Hagras, Hani (6701586037)","56297256800; 16644066900; 57193229998; 15520790700; 35748840700; 55034746100; 6701586037","Type-2 Fuzzy Entropy Sets","2017","https://www.scopus.com/inward/record.uri?eid=2-s2.0-85029393004&doi=10.1109%2fTFUZZ.2016.2593497&partnerID=40&md5=b479fa7048337fa8b5bff84b53fe457b"
"Marconi A.; Allende Prieto C.; Amado P.J.; Amate M.; Augusto S.R.; Becerril S.; Bezawada N.; Boisse I.; Bouchy F.; Cabral A.; Chazelas B.; Cirami R.; Coretti I.; Cristiani S.; Cupani G.; De Castro Leão I.; De Medeiros J.R.; De Souza M.A.F.; Di Marcantonio P.; Di Varano I.; D'Odorico V.; Drass H.; Figueira P.; Fragoso A.B.; Fynbo J.P.U.; Genoni M.; González Hernández J.I.; Haehnelt M.; Hughes I.; Huke P.; Kjeldsen H.; Korn A.J.; Landoni M.; Liske J.; Lovis C.; Maiolino R.; Marquart T.; Martins C.J.A.P.; Mason E.; Monteiro M.A.; Morris T.; Murray G.; Niedzielski A.; Oliva E.; Origlia L.; Pallé E.; Parr-Burman P.; Parro V.C.; Pepe F.; Piskunov N.; Rasilla J.L.; Rees P.; Rebolo R.; Riva M.; Rousseau S.; Sanna N.; Santos N.C.; Shen T.-C.; Sortino F.; Sosnowska D.; Sousa S.; Stempels E.; Strassmeier K.; Tenegi F.; Tozzi A.; Udry S.; Valenziano L.; Vanzi L.; Weber M.; Woche M.; Xompero M.; Zackrisson E.","Marconi, A. (7006873411); Allende Prieto, C. (55667439800); Amado, P.J. (6701796940); Amate, M. (55546226000); Augusto, S.R. (6507567375); Becerril, S. (10140526500); Bezawada, N. (14824712600); Boisse, I. (23988784400); Bouchy, F. (6603747336); Cabral, A. (14619014800); Chazelas, B. (6506939986); Cirami, R. (16635214000); Coretti, I. (26645524100); Cristiani, S. (7005799592); Cupani, G. (25224942800); De Castro Leão, I. (36974912900); De Medeiros, J.R. (7006360096); De Souza, M.A.F. (57203684177); Di Marcantonio, P. (6603438755); Di Varano, I. (17345348100); D'Odorico, V. (6602324415); Drass, H. (16070410900); Figueira, P. (56897006800); Fragoso, A.B. (6701647010); Fynbo, J.P.U. (7003889105); Genoni, M. (57203682063); González Hernández, J.I. (8870015300); Haehnelt, M. (7003612136); Hughes, I. (36637490600); Huke, P. (6503977516); Kjeldsen, H. (57204345527); Korn, A.J. (57210713987); Landoni, M. (55542489700); Liske, J. (6603261832); Lovis, C. (21635826000); Maiolino, R. (56252981100); Marquart, T. (14028792900); Martins, C.J.A.P. (22951241500); Mason, E. (56248874700); Monteiro, M.A. (55492892800); Morris, T. (26658528600); Murray, G. (7202037243); Niedzielski, A. (23012784000); Oliva, E. (56233112800); Origlia, L. (7004900830); Pallé, E. (57188660772); Parr-Burman, P. (6506352086); Parro, V.C. (57223676830); Pepe, F. (9532342600); Piskunov, N. (8875914700); Rasilla, J.L. (6603214736); Rees, P. (14008401500); Rebolo, R. (36490343100); Riva, M. (58724778700); Rousseau, S. (7004552037); Sanna, N. (57203682032); Santos, N.C. (35459624400); Shen, T.-C. (55438450000); Sortino, F. (57191522972); Sosnowska, D. (6602121900); Sousa, S. (56871297700); Stempels, E. (24400122300); Strassmeier, K. (7004127960); Tenegi, F. (6506716700); Tozzi, A. (9238899700); Udry, S. (7003897842); Valenziano, L. (6602565951); Vanzi, L. (6701672359); Weber, M. (8616085200); Woche, M. (6602620446); Xompero, M. (6506457551); Zackrisson, E. (8527481100)","7006873411; 55667439800; 6701796940; 55546226000; 6507567375; 10140526500; 14824712600; 23988784400; 6603747336; 14619014800; 6506939986; 16635214000; 26645524100; 7005799592; 25224942800; 36974912900; 7006360096; 57203684177; 6603438755; 17345348100; 6602324415; 16070410900; 56897006800; 6701647010; 7003889105; 57203682063; 8870015300; 7003612136; 36637490600; 6503977516; 57204345527; 57210713987; 55542489700; 6603261832; 21635826000; 56252981100; 14028792900; 22951241500; 56248874700; 55492892800; 26658528600; 7202037243; 23012784000; 56233112800; 7004900830; 57188660772; 6506352086; 57223676830; 9532342600; 8875914700; 6603214736; 14008401500; 36490343100; 58724778700; 7004552037; 57203682032; 35459624400; 55438450000; 57191522972; 6602121900; 56871297700; 24400122300; 7004127960; 6506716700; 9238899700; 7003897842; 6602565951; 6701672359; 8616085200; 6602620446; 6506457551; 8527481100","ELT-HIRES, the high resolution spectrograph for the ELT: Results from the Phase A study","2018","https://www.scopus.com/inward/record.uri?eid=2-s2.0-85052620407&doi=10.1117%2f12.2311664&partnerID=40&md5=57017ba501792222e9a50772a39ad8d8"
"Montenegro T.; Melo H.; Coelho R.; Barbosa E.","Montenegro, Taiza (57203243056); Melo, Hugo (56009925000); Coelho, Roberta (17433405500); Barbosa, Eiji (7101709953)","57203243056; 56009925000; 17433405500; 7101709953","Improving developers awareness of the exception handling policy","2018","https://www.scopus.com/inward/record.uri?eid=2-s2.0-85051000108&doi=10.1109%2fSANER.2018.8330228&partnerID=40&md5=b98c31b17c05f04b806e3152fe19052f"
"Costa L.R.; Aloise D.; Mladenović N.","Costa, Leandro R. (57194633011); Aloise, Daniel (12759644500); Mladenović, Nenad (55947364100)","57194633011; 12759644500; 55947364100","Less is more: basic variable neighborhood search heuristic for balanced minimum sum-of-squares clustering","2017","https://www.scopus.com/inward/record.uri?eid=2-s2.0-85021316393&doi=10.1016%2fj.ins.2017.06.019&partnerID=40&md5=37b65bb953af3bcf957469a0fb963a29"
"Medeiros Rocha M.; Patrocinio Da Silva J.; Das Chagas Barbosa De Sena F.","Medeiros Rocha, Manasses (57201472494); Patrocinio Da Silva, Jose (8776554000); Das Chagas Barbosa De Sena, Francisco (57201471020)","57201472494; 8776554000; 57201471020","Simulation of a Fuzzy Control Applied to a Variable Speed Wind System Connected to the Electrical Network","2018","https://www.scopus.com/inward/record.uri?eid=2-s2.0-85045015644&doi=10.1109%2fTLA.2018.8327408&partnerID=40&md5=c3f8859ffdd42982cfb099b5e693165c"
"Lima G.F.; Freitas V.C.G.; Araújo R.P.; Maitelli A.L.; Salazar A.O.","Lima, Gustavo F. (58001903800); Freitas, Victor C. G. (57195733388); Araújo, Renan P. (36605833100); Maitelli, André L. (6602549353); Salazar, Andrés O. (7102422753)","58001903800; 57195733388; 36605833100; 6602549353; 7102422753","Pig’s speed estimated with pressure transducers and hall effect sensor: An industrial application of sensors to validate a testing laboratory","2017","https://www.scopus.com/inward/record.uri?eid=2-s2.0-85029717168&doi=10.3390%2fs17092119&partnerID=40&md5=d299b8dbb48f9cd471a31bb9c86e5e19"
"Pereira I.; Silveira L.F.; Gonçalves L.","Pereira, Igor (57195577525); Silveira, Luiz F. (56363591700); Gonçalves, Luiz (58069927800)","57195577525; 56363591700; 58069927800","Video synchronization with bit-rate signals and correntropy function","2017","https://www.scopus.com/inward/record.uri?eid=2-s2.0-85028939796&doi=10.3390%2fs17092021&partnerID=40&md5=113ffee380487a33b5f2870724d4be86"
"Silva F.J.S.; Catunda S.Y.C.; Dorea C.E.T.; Van Haandel A.C.","Silva, Francisco J.S. (57198845424); Catunda, Sebastian Y.C. (6602674444); Dorea, Carlos E.T. (7004096252); Van Haandel, Adrianus C. (6603817880)","57198845424; 6602674444; 7004096252; 6603817880","Modelling and estimation of the oxygen transfer function in a bioreactor with aeration driven by PWM signal","2018","https://www.scopus.com/inward/record.uri?eid=2-s2.0-85059945650&doi=10.1109%2fINSCIT.2018.8546719&partnerID=40&md5=92216db5e892bcb4076888894db75e39"
"Reichenbach I.G.; Bohley M.; Sousa F.J.P.; Aurich J.C.","Reichenbach, Ingo G. (55179610500); Bohley, Martin (55871783600); Sousa, Fabio J. P. (14061173900); Aurich, Jan C. (7005485993)","55179610500; 55871783600; 14061173900; 7005485993","Micromachining of PMMA—manufacturing of burr-free structures with single-edge ultra-small micro end mills","2018","https://www.scopus.com/inward/record.uri?eid=2-s2.0-85043382808&doi=10.1007%2fs00170-018-1821-4&partnerID=40&md5=420db76fcbc0d5f79d3d512e4746bfea"
"Tavares S.A.C.; Cavalcanti R.J.B.V.M.; Silva D.R.C.; Nogueira M.B.; Rodrigues M.C.","Tavares, Sayonara A.C. (57203640495); Cavalcanti, Ricardo J.B.V.M. (57203641905); Silva, Diego R. C. (24722389500); Nogueira, Marcelo B. (50661492500); Rodrigues, Marconi C. (57203639001)","57203640495; 57203641905; 24722389500; 50661492500; 57203639001","Telemetry for Domestic Water Consumption Based on IOT and Open Standards","2018","https://www.scopus.com/inward/record.uri?eid=2-s2.0-85052514241&doi=10.1109%2fMETROI4.2018.8428333&partnerID=40&md5=b18ecb48e8ba6778fc7144f7f908ae80"
"Silveira L.G.D.Q.; Dinis R.","Silveira, Luiz Gonzaga De Queiroz (35616848800); Dinis, Rui (6701511111)","35616848800; 6701511111","Wavelet-Time Diversity Transmission in Wireless Systems: Bit-Error Probability","2017","https://www.scopus.com/inward/record.uri?eid=2-s2.0-85040580594&doi=10.1109%2fVTCSpring.2017.8108436&partnerID=40&md5=2fd90f57e5b2d836a164c4415b171f0d"
"De Carvalho Neto J.T.; De Oliveira Cavalcanti A.L.; Ortiz Salazar A.","De Carvalho Neto, Joao Teixeira (55569752100); De Oliveira Cavalcanti, Anderson Luiz (8275338200); Ortiz Salazar, Andres (7102422753)","55569752100; 8275338200; 7102422753","Design and Implementation of DSP-Based H-Infinity Robust Controller for a Boost Converter","2018","https://www.scopus.com/inward/record.uri?eid=2-s2.0-85070969990&doi=10.1109%2fTLA.2018.8795118&partnerID=40&md5=c8b719876cb6162a4f697f9f7dc62597"
"Mota F.; Luna T.","Mota, Francisco (22433683100); Luna, Tania (56027445900)","22433683100; 56027445900","A Technique for Computing the Convolution of Exponential Signals and its Application in Systems Theory","2018","https://www.scopus.com/inward/record.uri?eid=2-s2.0-85055623503&doi=10.1109%2fTAEE.2018.8476021&partnerID=40&md5=e0621ee09eaf4d42917f2fc7531ca2b1"
"Rosa M.; Rodrigues L.; González M.","Rosa, Marcela (57195755158); Rodrigues, Lucas (57195284694); González, Mario (55237687400)","57195755158; 57195284694; 55237687400","Business games and creativity stimulus: The behavior of three different teams in the ideation process","2018","https://www.scopus.com/inward/record.uri?eid=2-s2.0-85057181500&partnerID=40&md5=4497a89156f44bfb460c33580d01ee55"
"Leal M.S.R.; Simões L.D.; França R.L.S.; Leal M.M.; Costa F.B.; Taveiros F.E.","Leal, M.S.R. (57202999780); Simões, L.D. (57207301320); França, R.L.S. (57203003614); Leal, M.M. (57203387044); Costa, Flavio B. (22333585200); Taveiros, F.E. (56132137800)","57202999780; 57207301320; 57203003614; 57203387044; 22333585200; 56132137800","Methodology to Perform Real-Time Simulation of Power Systems Using a FPGA-based Platform","2018","https://www.scopus.com/inward/record.uri?eid=2-s2.0-85062383890&doi=10.1109%2fWCNPS.2018.8604373&partnerID=40&md5=0be2306cc814c9c7c3ee96d5e8c6bf05"
"Brinkmann G.; Bessa W.M.; Duecker D.-A.; Kreuzer E.; Solowjow E.","Brinkmann, Gerrit (57205471592); Bessa, Wallace M. (6506394388); Duecker, Daniel-A. (57194008996); Kreuzer, Edwin (7005071866); Solowjow, Eugen (55540606300)","57205471592; 6506394388; 57194008996; 7005071866; 55540606300","Reinforcement learning of depth stabilization with a micro diving agent","2018","https://www.scopus.com/inward/record.uri?eid=2-s2.0-85060152374&doi=10.1109%2fICRA.2018.8461137&partnerID=40&md5=a927b342c636dba1f020ae0348e7b4fa"
"Oliveira J.; Macedo H.; Cacho N.; Romanovsky A.","Oliveira, Juliana (56244638400); Macedo, Hivana (57205341099); Cacho, Nelio (17433450200); Romanovsky, Alexander (7007118808)","56244638400; 57205341099; 17433450200; 7007118808","DroidEH: An Exception Handling Mechanism for Android Applications","2018","https://www.scopus.com/inward/record.uri?eid=2-s2.0-85059610810&doi=10.1109%2fISSRE.2018.00030&partnerID=40&md5=21f309a0814d48115b5d8a340fca7a92"
"Oliveira J.","Oliveira, Juliana (56244638400)","56244638400","Taming Exceptions in Android Applications","2018","https://www.scopus.com/inward/record.uri?eid=2-s2.0-85059863970&doi=10.1109%2fISSREW.2018.000-2&partnerID=40&md5=100d86d118474e4168ef86d752418b47"
"De Carvalho Neto J.T.; Salazar A.O.; Lock A.S.; Fonseca D.A.","De Carvalho Neto, Joao Teixeira (55569752100); Salazar, Andres Ortiz (7102422753); Lock, Alberto Soto (14834340200); Fonseca, Diego Antonio (36682132200)","55569752100; 7102422753; 14834340200; 36682132200","One cycle control for battery connected standalone photovoltaic systems for DC loads","2018","https://www.scopus.com/inward/record.uri?eid=2-s2.0-85052759277&doi=10.1109%2fTLA.2018.8447365&partnerID=40&md5=79d41d59dce3b65a634814582d027acd"
"Silva M.; Vieira E.; Signoretti G.; Silva I.; Silva D.; Ferrari P.","Silva, Marianne (57207807053); Vieira, Elton (57204021700); Signoretti, Gabriel (57192920994); Silva, Ivanovitch (36537969500); Silva, Diego (24722389500); Ferrari, Paolo (57195277194)","57207807053; 57204021700; 57192920994; 36537969500; 24722389500; 57195277194","A customer feedback platform for vehicle manufacturing compliant with industry 4.0 vision","2018","https://www.scopus.com/inward/record.uri?eid=2-s2.0-85054072596&doi=10.3390%2fs18103298&partnerID=40&md5=64b957fddf679306d429a28f1b7bc1c1"
"Abinader F.M., Jr.; Choudhury S.; de Sousa V.A., Jr.; Chaves F.S.; Cavalcante A.M.; Almeida E.P.L.; Vieira R.; Tuomaala E.; Doppler K.","Abinader, Fuad M. (55762821500); Choudhury, Sayantan (57198392529); de Sousa, Vicente A. (6603844872); Chaves, Fabiano S. (8284527400); Cavalcante, André M. (15925100000); Almeida, Erika P. L. (55204048400); Vieira, Robson (56231906400); Tuomaala, Esa (23391153700); Doppler, Klaus (15623233300)","55762821500; 57198392529; 6603844872; 8284527400; 15925100000; 55204048400; 56231906400; 23391153700; 15623233300","Distributed Wi-Fi Interference Coordination for Dense Deployments","2017","https://www.scopus.com/inward/record.uri?eid=2-s2.0-85020072304&doi=10.1007%2fs11277-017-4550-3&partnerID=40&md5=e833b622a4010134995be5d88c3fdac9"
"de Araújo R.P.; de Freitas V.C.G.; de Lima G.F.; Salazar A.O.; Neto A.D.D.; Maitelli A.L.","de Araújo, Renan Pires (57203942030); de Freitas, Victor Carvalho Galvão (57203942635); de Lima, Gustavo Fernandes (57203941246); Salazar, Andrés Ortiz (7102422753); Neto, Adrião Duarte Dória (7102618949); Maitelli, André Laurindo (6602549353)","57203942030; 57203942635; 57203941246; 7102422753; 7102618949; 6602549353","Pipeline inspection gauge’s velocity simulation based on pressure differential using artificial neural networks","2018","https://www.scopus.com/inward/record.uri?eid=2-s2.0-85053682407&doi=10.3390%2fs18093072&partnerID=40&md5=93dce7c1ce171db7b6371b5ac805aac9"
"Leite J.; Batista T.; Oquendo F.; Silva E.; Santos L.; Cortez V.","Leite, Jair (23392964600); Batista, Thais (36812228000); Oquendo, Flavio (6602992155); Silva, Eduardo (42561692600); Santos, Lidiane (57202100718); Cortez, Victor (57203654913)","23392964600; 36812228000; 6602992155; 42561692600; 57202100718; 57203654913","Designing and Executing Software Architectures Models Using SysADL Studio","2018","https://www.scopus.com/inward/record.uri?eid=2-s2.0-85052592478&doi=10.1109%2fICSA-C.2018.00030&partnerID=40&md5=70a431d202279aaab63f9bf0de2d6fd8"
"Carrero M.A.; Musicante M.A.; Dos Santos A.L.; Hara C.S.","Carrero, Marcos Aurélio (8868639900); Musicante, Martin Alejandro (8586992500); Dos Santos, Aldri Luiz (8988932400); Hara, Carmem Satie (7005592644)","8868639900; 8586992500; 8988932400; 7005592644","A reusable component-based model for WSN storage simulation","2017","https://www.scopus.com/inward/record.uri?eid=2-s2.0-85041231364&doi=10.1145%2f3132114.3132118&partnerID=40&md5=f8c8448a205c0e3c0e7750c48d7ed2e6"
"Costa J.; Araujo D.; Silva D.R.C.; Nogueira M.B.; Rodrigues M.C.","Costa, Judson (57203633555); Araujo, Daniel (57220508902); Silva, Diego R. C. (24722389500); Nogueira, Marcelo B. (50661492500); Rodrigues, Marconi C. (57203639001)","57203633555; 57220508902; 24722389500; 50661492500; 57203639001","Home Automation Architecture Based on IOT Technologies","2018","https://www.scopus.com/inward/record.uri?eid=2-s2.0-85052497157&doi=10.1109%2fMETROI4.2018.8438863&partnerID=40&md5=1121b9a7702095ccb6ad3b272ceaadfd"
"Borges J.; Ziehr D.; Beigl M.; Cacho N.; Martins A.; Sudrich S.; Abt S.; Frey P.; Knapp T.; Etter M.; Popp J.","Borges, Julio (57189376958); Ziehr, Daniel (57203009766); Beigl, Michael (6603070716); Cacho, Nelio (17433450200); Martins, Allan (57985251100); Sudrich, Simon (57202160927); Abt, Samuel (57203011795); Frey, Patrick (57203001462); Knapp, Timo (57203004803); Etter, Michaela (57203006299); Popp, Johannes (57193787591)","57189376958; 57203009766; 6603070716; 17433450200; 57985251100; 57202160927; 57203011795; 57203001462; 57203004803; 57203006299; 57193787591","Feature engineering for crime hotspot detection","2018","https://www.scopus.com/inward/record.uri?eid=2-s2.0-85050236043&doi=10.1109%2fUIC-ATC.2017.8397586&partnerID=40&md5=79b4be014ffed24ac5bba3f60018d17d"
